{"format":"dali.crm.import","schema_version":"2.0","import_id":"550e8400-e29b-41d4-a716-446655440000","timezone":"America/Mexico_City","atomic":true,"source":{"kind":"example"},"operations":[{"operation_id":"goal-one","module":"objectives","entity":"goal","action":"upsert","dedupe_key":"sample:goal:1","needs_confirmation":true,"payload":{"title":"Ejemplo: definir mi siguiente paso","period":"daily","start_date":"2026-09-14","category":"Personal","recurrence":{"frequency":"daily","interval":1,"time_local":"14:30","days_of_week":[],"day_of_month":null,"timezone":"America/Mexico_City","end_date":null}}}]}
